LANGUAGE,English,French,Italian,Spanish,German,Comment,,,,,
STRC_01,,

STRCN_00,Training,Training,Training,Training,Training, Name of the mission
STRM_Rgoodluck,"GOOD LUCK ALPHA AND BRAVO. OVER.",hq
STRM_Rmeauxdone,"CITY OF MEAUX IS UNDER OUR CONTROL. GOOD JOB. OVER.",hq
STRM_Rtyronedone,"TYRONE HAS BEEN CLEANED OUT. OVER.",hq
STRM_Rhospitaldone,"HOSPITAL HAS CAPTURED. OVER.",hq
STRM_Rgravettedone,"GRAVETTE UNDER NATO CONTROL. OVER.",hq
STRM_Rmcomplete,"ALL RUSSIANS HAVE BEEN NEUTRALIZED. MISSION IS ACCOMPLISHED. PAPA BEAR OUT.",hq
